{
  "contract": "crosscorpus-release/v1",
  "corpus_id": "coprepan",
  "frozen_at": "2026-10-08T00:00:00Z",
  "frozen_by": "fixture",
  "release_id": "coprepan-0000.1",
  "release_manifest_sha256": "b595003c05ca40e61cc01bc5969328ba03d6485677da641552a9228ec990677d",
  "schema": "crosscorpus-release-freeze/v1",
  "state": "FROZEN"
}
