{
  "contract": "crosscorpus-release/v1",
  "corpus_id": "corapan",
  "frozen_at": "2026-10-08T00:00:00Z",
  "frozen_by": "fixture",
  "release_id": "corapan-0000-01",
  "release_manifest_sha256": "7b9bc9982c8fc83daee3a903ceaa6eafcb04bd7ff320eb7bf92d4812e40d5211",
  "schema": "crosscorpus-release-freeze/v1",
  "state": "FROZEN"
}
